{
  "algorithm_seed": 7,
  "attempt_id": "006ac6b74aa40a66e22e16dafa5488be265d70f0c9493d046ecfe2eb9c6100f6",
  "authorization_id": null,
  "budgets": {
    "max_field_bits": 32,
    "max_group_law_invocations": 100000,
    "max_memory_bytes": 67108864,
    "max_steps": 100000,
    "max_subgroup_order_bits": 32,
    "max_table_entries": 65536,
    "timeout_ns": 5000000000,
    "workers": 1
  },
  "candidate_id": null,
  "contract_kind": "method_request_v1",
  "curve": {
    "curve_a": 0,
    "curve_b": 7,
    "curve_id": "toy-secp-j0-b13-c0-p5923",
    "field_bits": 13,
    "field_p": 5923
  },
  "curve_catalog_sha256": "d293afa7e5b614f39ed00356e35ee81a400b57ee9656907170193cb3aca0bbd7",
  "curve_fixture_id": "toy-secp-j0-b13-c0-p5923",
  "framework_authorization_class": "fixture",
  "generator": [3665, 430],
  "hypothesis_id": null,
  "internal_classification": "engineering_only",
  "method_id": "bsgs_v1",
  "native_research_outcome": false,
  "provenance": {
    "config_sha256": "536a86cc289e5e296afe69aea548cb317b50e0af6e17a61419bb3f02b6799bff",
    "diff_sha256": null,
    "producer_dependency_sha256s": ["2222222222222222222222222222222222222222222222222222222222222222"],
    "source_commit": "0123456789abcdef0123456789abcdef01234567",
    "source_snapshot_sha256": "1111111111111111111111111111111111111111111111111111111111111111",
    "source_tree_clean": true,
    "validator_dependency_sha256s": ["3333333333333333333333333333333333333333333333333333333333333333"]
  },
  "public_precomputation": null,
  "public_scalar_interval": null,
  "public_target_vector_sha256": "f530af54bbc7c68523bef1abcf97853d7c635244c15f5c071f91857ecf8083d8",
  "record_kind": "lab_engineering_fixture",
  "request_id": "ffffffffffffffffffffffffffffffffffffffffffffffffffffffffffffffff",
  "retainable": false,
  "retention_class": "engineering_only",
  "route_effect": "none",
  "schema_version": 1,
  "subgroup_order": 5827,
  "subgroup_order_bits": 13,
  "target": [3665, 430],
  "work_unit_id": "9fe1df57d4477c89c5b7082c3716d6bb7a4cee4c1b31cf96ea994a97f8a95498"
}
